{
  "schema": "sparkbench.result.v1",
  "label": "sweep-q4-mtp16",
  "quant": "q4",
  "model": {
    "name": "qwen3.8-MTP:27b",
    "file": "/usr/share/ollama/.ollama/models/blobs/sha256-bee238bbeb3dc0a34bde4d0dedbaee1f98c009e8bb4226f03070054c12fb1372",
    "sha256": "bee238bbeb3dc0a34bde4d0dedbaee1f98c009e8bb4226f03070054c12fb1372",
    "quantization": "UD-Q4_K_XL",
    "source": "unsloth/Qwen3.8-27B-GGUF"
  },
  "runtime": {
    "name": "llama.cpp",
    "version": "d2f83055d6e3b379b5d34c4837122a918cf402c2",
    "binary": "/home/admin/llama.cpp-main-20260810/build/bin/llama-server"
  },
  "backend": {
    "kind": "openai",
    "base_url": "http://127.0.0.1:18082",
    "api": "/v1/chat/completions",
    "managed_server": true,
    "tokenizer": "llama.cpp",
    "extra_body": {
      "cache_prompt": false
    }
  },
  "host": {
    "name": null,
    "gpu": "NVIDIA GB10",
    "driver": "580.173.02",
    "arch": "aarch64",
    "kernel": "6.17.0-1029-nvidia",
    "os": null,
    "cpus": 20,
    "source": "README.md 'Test system' table (legacy import; hostname was not recorded)"
  },
  "parameters": {
    "mtp_depth": 16,
    "temperature": 0,
    "seed": 42,
    "context": 69632,
    "parallel": 1,
    "kv_k": "q8_0",
    "kv_v": "q8_0"
  },
  "config_sha256": "7247cac43312a59fbfef05285df5c4b59c32c0353366891067903518c636d11f",
  "workload_sha256": "5f99b0c12df1e18ba23a71b6cc3762ef8614ebe81250058ad0fc896d1f8b262e",
  "config": {
    "run": {
      "label": "sweep-q4-mtp16",
      "quant": "q4"
    },
    "model": {
      "name": "qwen3.8-MTP:27b",
      "file": "/usr/share/ollama/.ollama/models/blobs/sha256-bee238bbeb3dc0a34bde4d0dedbaee1f98c009e8bb4226f03070054c12fb1372",
      "sha256": "bee238bbeb3dc0a34bde4d0dedbaee1f98c009e8bb4226f03070054c12fb1372",
      "quantization": "UD-Q4_K_XL",
      "source": "unsloth/Qwen3.8-27B-GGUF"
    },
    "runtime": {
      "name": "llama.cpp",
      "binary": "/home/admin/llama.cpp-main-20260810/build/bin/llama-server"
    },
    "backend": {
      "base_url": "http://127.0.0.1:18082",
      "tokenizer": "llama.cpp",
      "extra_body": {
        "cache_prompt": false
      }
    },
    "server": {
      "command": [
        "/home/admin/llama.cpp-main-20260810/build/bin/llama-server",
        "--model",
        "/usr/share/ollama/.ollama/models/blobs/sha256-bee238bbeb3dc0a34bde4d0dedbaee1f98c009e8bb4226f03070054c12fb1372",
        "--alias",
        "qwen3.8-MTP:27b",
        "--host",
        "127.0.0.1",
        "--port",
        "18082",
        "--no-webui",
        "--offline",
        "--ctx-size",
        "69632",
        "--parallel",
        "1",
        "--gpu-layers",
        "all",
        "--fit",
        "off",
        "--flash-attn",
        "on",
        "--cache-type-k",
        "q8_0",
        "--cache-type-v",
        "q8_0",
        "--batch-size",
        "2048",
        "--ubatch-size",
        "2048",
        "--jinja",
        "--reasoning",
        "off",
        "--reasoning-budget",
        "0",
        "--reasoning-format",
        "deepseek",
        "--spec-type",
        "draft-mtp",
        "--spec-draft-n-max",
        "16",
        "--spec-draft-ngl",
        "all",
        "--log-verbosity",
        "2"
      ]
    },
    "request": {
      "temperature": 0,
      "seed": 42
    },
    "parameters": {
      "mtp_depth": 16,
      "context": 69632,
      "parallel": 1,
      "kv_k": "q8_0",
      "kv_v": "q8_0"
    },
    "workload": "predictable_9"
  },
  "source": {
    "tool": "sparkbench 1.0.0",
    "kind": "import",
    "importer": "sweeps",
    "files": [
      {
        "path": "mtp_sweep/results.json",
        "sha256": "4ea5dfea9769224a597cbfb147cc65b8157583abb923804640006f89c00d13d9"
      }
    ],
    "notes": [
      "mode mtp16 of the Q4 MTP depth sweep (Qwen3.8-27B UD-Q4_K_XL)"
    ]
  },
  "timings": {
    "started_at_utc": "2026-08-17T02:01:24Z",
    "completed_at_utc": "2026-08-20T01:02:01Z",
    "wall_seconds": 599.1835029848735
  },
  "smoke": false,
  "complete": true,
  "suites": {
    "predictable_9": {
      "description": "Predictable 8K/32K/64K sweep: sequence, strict JSON and Python code at three context sizes",
      "complete": true,
      "quality": 1.0,
      "quality_label": "exact",
      "verdicts": {
        "pass": 9,
        "fail": 0,
        "error": 0,
        "unscored": 0
      },
      "metrics": {
        "passed": 9,
        "total": 9,
        "legacy_aggregate": {
          "passed": 9,
          "total": 9,
          "all_passed": true,
          "prompt_tokens": 310227,
          "prompt_seconds": 504.884391,
          "prompt_tokens_per_second": 614.4515566931044,
          "generated_tokens": 3582,
          "decode_seconds": 93.9178,
          "decode_tokens_per_second": 38.139734959720094,
          "median_case_decode_tokens_per_second": 32.42248841562255,
          "minimum_case_decode_tokens_per_second": 20.40237565262099,
          "wall_seconds": 599.1835029848735,
          "draft_generated": 4480,
          "draft_accepted": 3301,
          "draft_acceptance": 0.7368303571428572,
          "max_server_rss_mib": 3376.32421875,
          "speedup_vs_baseline": 4.1577336013514685
        },
        "by_context": {
          "8k": {
            "passed": 3,
            "total": 3,
            "all_passed": true,
            "prompt_tokens": 23407,
            "prompt_seconds": 32.899471000000005,
            "prompt_tokens_per_second": 711.4704063174753,
            "generated_tokens": 1165,
            "decode_seconds": 27.774600000000003,
            "decode_tokens_per_second": 41.94479848494667,
            "median_case_decode_tokens_per_second": 32.42248841562255,
            "minimum_case_decode_tokens_per_second": 20.40237565262099,
            "wall_seconds": 60.77073524595471,
            "draft_generated": 1504,
            "draft_accepted": 1072,
            "draft_acceptance": 0.7127659574468085,
            "max_server_rss_mib": 2837.5859375
          },
          "32k": {
            "passed": 3,
            "total": 3,
            "all_passed": true,
            "prompt_tokens": 95419,
            "prompt_seconds": 146.419197,
            "prompt_tokens_per_second": 651.683672326109,
            "generated_tokens": 1208,
            "decode_seconds": 30.228803,
            "decode_tokens_per_second": 39.961886681387945,
            "median_case_decode_tokens_per_second": 36.13786595863219,
            "minimum_case_decode_tokens_per_second": 30.44221327620898,
            "wall_seconds": 176.77916850696784,
            "draft_generated": 1472,
            "draft_accepted": 1113,
            "draft_acceptance": 0.7561141304347826,
            "max_server_rss_mib": 3093.8984375
          },
          "64k": {
            "passed": 3,
            "total": 3,
            "all_passed": true,
            "prompt_tokens": 191401,
            "prompt_seconds": 325.565723,
            "prompt_tokens_per_second": 587.9027995831121,
            "generated_tokens": 1209,
            "decode_seconds": 35.914396999999994,
            "decode_tokens_per_second": 33.663380175922214,
            "median_case_decode_tokens_per_second": 31.20255964997662,
            "minimum_case_decode_tokens_per_second": 23.200182830038084,
            "wall_seconds": 361.63359923195094,
            "draft_generated": 1504,
            "draft_accepted": 1116,
            "draft_acceptance": 0.7420212765957447,
            "max_server_rss_mib": 3376.32421875
          }
        },
        "exact_matches_with_baseline": 8,
        "semantic_matches_with_baseline": 9
      },
      "aggregate": {
        "cases": 9,
        "prompt_tokens": 310227,
        "prompt_tokens_per_second": 614.4515566931044,
        "generated_tokens": 3582,
        "decode_tokens_per_second": 38.139734959720094,
        "median_case_decode_tokens_per_second": 32.42248841562255,
        "wall_seconds": 599.1835029848735,
        "draft_generated": 4480,
        "draft_accepted": 3301,
        "draft_acceptance": 0.7368303571428572
      },
      "timing_source": "server",
      "cases": [
        {
          "id": "8k_predictable_sequence",
          "verdict": "pass",
          "prompt_sha256": "141d16d1af8a2c9d7092f9adc8e6ff66fe0b5249e0dafdb54f70cd8f191ab54c",
          "api_calls": 1,
          "tokens": {
            "prompt": 7803,
            "generated": 916,
            "draft_generated": 1056,
            "draft_accepted": 849
          },
          "time": {
            "wall_seconds": 30.6077825090033,
            "prompt_ms": 10978.877,
            "decode_ms": 19549.612
          },
          "tok_s": {
            "prompt": 710.7284287819236,
            "decode": 46.85514986179776
          },
          "timing_source": "server",
          "finish_reason": "stop",
          "content": "1,2,3,4,5,6,7,8,9,10,11,12,13,14,15,16,17,18,19,20,21,22,23,24,25,26,27,28,29,30,31,32,33,34,35,36,37,38,39,40,41,42,43,44,45,46,47,48,49,50,51,52,53,54,55,56,57,58,59,60,61,62,63,64,65,66,67,68,69,70,71,72,73,74,75,76,77,78,79,80,81,82,83,84,85,86,87,88,89,90,91,92,93,94,95,96,97,98,99,100,101,102,103,104,105,106,107,108,109,110,111,112,113,114,115,116,117,118,119,120,121,122,123,124,125,126,127,128,129,130,131,132,133,134,135,136,137,138,139,140,141,142,143,144,145,146,147,148,149,150,151,152,153,154,155,156,157,158,159,160,161,162,163,164,165,166,167,168,169,170,171,172,173,174,175,176,177,178,179,180,181,182,183,184,185,186,187,188,189,190,191,192,193,194,195,196,197,198,199,200,201,202,203,204,205,206,207,208,209,210,211,212,213,214,215,216,217,218,219,220,221,222,223,224,225,226,227,228,229,230,231,232,233,234,235,236,237,238,239,240,241,242,243,244,245,246,247,248,249,250,251,252,253,254,255,256",
          "content_sha256": "9a87b35ebf8757b50c09002b080f04343fb7482dfc78f45a123bd3e03a70a0c3",
          "detail": {
            "context": "8k",
            "workload": "predictable_sequence",